<configuration xmlns="urn:jboss:messaging"
            xmlns:xsi="http://www.w3.org/2001/XMLSchema-instance"
            xsi:schemaLocation="urn:jboss:messaging ../schemas/jbm-configuration.xsd">

    <!-- true to expose JBoss Messaging resources through JMX -->
    <jmx-management-enabled>true</jmx-management-enabled>

   <!-- Connectors -->
   <connectors>
      <connector name="netty">
         <factory-class>org.jboss.messaging.integration.transports.netty.NettyConnectorFactory</factory-class>
         <param key="jbm.remoting.netty.port" value="5445" type="Integer"/>
      </connector>
   </connectors>
   
   <!-- Acceptors -->
   <acceptors>
      <acceptor name="netty">
         <factory-class>org.jboss.messaging.integration.transports.netty.NettyAcceptorFactory</factory-class>
         <param key="jbm.remoting.netty.port" value="5445" type="Integer"/>
      </acceptor>
   </acceptors>

   <!-- Other config -->

   <journal-min-files>2</journal-min-files>

</configuration>
