<deployment xmlns="urn:jboss:messaging"
            xmlns:xsi="http://www.w3.org/2001/XMLSchema-instance"
            xsi:schemaLocation="urn:jboss:messaging ../schemas/jbm-configuration.xsd">
   <configuration>

      <clustered>true</clustered>

      <!-- Connectors -->
      
      <connector name="netty-connector">
         <factory-class>org.jboss.messaging.integration.transports.netty.NettyConnectorFactory</factory-class>
	 <param key="jbm.remoting.netty.port" value="5446" type="Integer"/>
      </connector>
      
      <!-- Acceptors -->
      
      <acceptor name="netty-acceptor">
	 <factory-class>org.jboss.messaging.integration.transports.netty.NettyAcceptorFactory</factory-class>
	 <param key="jbm.remoting.netty.port" value="5446" type="Integer"/>
      </acceptor>
      
      <!-- Clustering configuration -->
      
      <broadcast-group name="my-broacast-group">
	 <group-address>231.7.7.7</group-address>
	 <group-port>9876</group-port>
	 <broadcast-period>100</broadcast-period>
	 <connector-ref connector-name="netty-connector"/>
      </broadcast-group>
      
      <discovery-group name="my-discovery-group">
	 <group-address>231.7.7.7</group-address>
	 <group-port>9876</group-port>
	 <refresh-timeout>10000</refresh-timeout>
      </discovery-group>
      
      <cluster-connection name="my-cluster">
	 <address>jms</address>
	 <retry-interval>500</retry-interval>
	 <use-duplicate-detection>true</use-duplicate-detection>
	 <forward-when-no-consumers>true</forward-when-no-consumers>
	 <max-hops>1</max-hops>
	 <discovery-group-ref discovery-group-name="my-discovery-group"/>
      </cluster-connection>
      
      <!-- Other config -->
      
      <paging-directory>server1/data/paging</paging-directory>

      <bindings-directory>server1/data/bindings</bindings-directory>

      <journal-directory>server1/data/journal</journal-directory>
     
      <journal-min-files>2</journal-min-files>

      <large-messages-directory>server1/data/largeMessages</large-messages-directory>
      
   </configuration>

</deployment>
